{
  "schema_version": 1,
  "message_type": "REQOTE",
  "release": "1.3c",
  "valid_from": "2025-04-01",
  "ordering_hint": [],
  "segments": [
    {
      "tag": "UNH",
      "name": "Message Header",
      "mandatory": true,
      "max_occurrences": 1,
      "elements": [
        {
          "id": "0062",
          "status": "M"
        },
        {
          "id": "S009",
          "status": "M"
        }
      ],
      "qualifier_restrictions": {}
    },
    {
      "tag": "BGM",
      "name": "Beginning of Message",
      "mandatory": true,
      "max_occurrences": 1,
      "elements": [
        {
          "id": "C002",
          "status": "M"
        },
        {
          "id": "C106",
          "status": "C"
        }
      ],
      "qualifier_restrictions": {
        "1001": [
          "311",
          "Z29",
          "Z57",
          "Z74",
          "Z93"
        ]
      }
    },
    {
      "tag": "DTM",
      "name": "Date/Time/Period",
      "mandatory": true,
      "max_occurrences": 5,
      "elements": [
        {
          "id": "C507",
          "status": "M"
        }
      ],
      "qualifier_restrictions": {
        "2005": [
          "137",
          "203",
          "163",
          "164",
          "469",
          "472"
        ]
      }
    },
    {
      "tag": "IMD",
      "name": "Item Description",
      "mandatory": false,
      "max_occurrences": 1,
      "elements": [
        {
          "id": "7077",
          "status": "C"
        },
        {
          "id": "C273",
          "status": "C"
        }
      ],
      "qualifier_restrictions": {}
    },
    {
      "tag": "FTX",
      "name": "Free Text",
      "mandatory": false,
      "max_occurrences": 2,
      "elements": [
        {
          "id": "4451",
          "status": "M"
        },
        {
          "id": "C108",
          "status": "C"
        }
      ],
      "qualifier_restrictions": {
        "4451": [
          "ZZZ",
          "REG"
        ]
      }
    },
    {
      "tag": "NAD",
      "name": "Name and Address",
      "mandatory": true,
      "max_occurrences": 4,
      "elements": [
        {
          "id": "3035",
          "status": "M"
        },
        {
          "id": "C082",
          "status": "C"
        }
      ],
      "qualifier_restrictions": {
        "3035": [
          "MS",
          "MR",
          "DP",
          "BY"
        ]
      }
    },
    {
      "tag": "CTA",
      "name": "Contact Information",
      "mandatory": false,
      "max_occurrences": 1,
      "elements": [
        {
          "id": "3139",
          "status": "C"
        },
        {
          "id": "C056",
          "status": "C"
        }
      ],
      "qualifier_restrictions": {}
    },
    {
      "tag": "COM",
      "name": "Communication Contact",
      "mandatory": false,
      "max_occurrences": 5,
      "elements": [
        {
          "id": "C076",
          "status": "M"
        }
      ],
      "qualifier_restrictions": {}
    },
    {
      "tag": "LOC",
      "name": "Place/Location Identification",
      "mandatory": false,
      "max_occurrences": 1,
      "elements": [
        {
          "id": "3227",
          "status": "M"
        },
        {
          "id": "C517",
          "status": "C"
        }
      ],
      "qualifier_restrictions": {
        "3227": [
          "172"
        ]
      }
    },
    {
      "tag": "LIN",
      "name": "Line Item",
      "mandatory": false,
      "max_occurrences": 200000,
      "elements": [
        {
          "id": "1082",
          "status": "C"
        },
        {
          "id": "1229",
          "status": "C"
        }
      ],
      "qualifier_restrictions": {}
    },
    {
      "tag": "UNT",
      "name": "Message Trailer",
      "mandatory": true,
      "max_occurrences": 1,
      "elements": [
        {
          "id": "0074",
          "status": "M"
        },
        {
          "id": "0062",
          "status": "M"
        }
      ],
      "qualifier_restrictions": {}
    }
  ],
  "segment_groups": [
    {
      "id": "SG1",
      "trigger_segment": "RFF",
      "mandatory": true,
      "max_occurrences": 9999,
      "segments": [
        {
          "tag": "RFF",
          "name": "Reference (Prüfidentifikator/Referenz)",
          "mandatory": true,
          "max_occurrences": 1,
          "elements": [
            {
              "id": "C506",
              "status": "M"
            }
          ],
          "qualifier_restrictions": {
            "1153": [
              "Z13",
              "AGO",
              "AEP",
              "AGK"
            ]
          }
        }
      ],
      "groups": []
    },
    {
      "id": "SG11",
      "trigger_segment": "NAD",
      "mandatory": true,
      "max_occurrences": 99,
      "segments": [
        {
          "tag": "NAD",
          "name": "Name and Address (MP-ID)",
          "mandatory": true,
          "max_occurrences": 1,
          "elements": [
            {
              "id": "3035",
              "status": "M"
            },
            {
              "id": "C082",
              "status": "C"
            }
          ],
          "qualifier_restrictions": {
            "3035": [
              "MS",
              "MR",
              "DP",
              "BY"
            ]
          }
        },
        {
          "tag": "LOC",
          "name": "Place/Location (Meldepunkt)",
          "mandatory": false,
          "max_occurrences": 99,
          "elements": [
            {
              "id": "3227",
              "status": "M"
            },
            {
              "id": "C517",
              "status": "C"
            }
          ],
          "qualifier_restrictions": {
            "3227": [
              "172"
            ]
          }
        }
      ],
      "groups": [
        {
          "id": "SG14",
          "trigger_segment": "CTA",
          "mandatory": false,
          "max_occurrences": 5,
          "segments": [
            {
              "tag": "CTA",
              "name": "Contact Information",
              "mandatory": true,
              "max_occurrences": 1,
              "elements": [
                {
                  "id": "3139",
                  "status": "C"
                },
                {
                  "id": "C056",
                  "status": "C"
                }
              ],
              "qualifier_restrictions": {}
            },
            {
              "tag": "COM",
              "name": "Communication Contact",
              "mandatory": false,
              "max_occurrences": 5,
              "elements": [
                {
                  "id": "C076",
                  "status": "M"
                }
              ],
              "qualifier_restrictions": {}
            }
          ],
          "groups": []
        }
      ]
    },
    {
      "id": "SG27",
      "trigger_segment": "LIN",
      "mandatory": false,
      "max_occurrences": 200000,
      "segments": [
        {
          "tag": "LIN",
          "name": "Line Item",
          "mandatory": true,
          "max_occurrences": 1,
          "elements": [
            {
              "id": "1082",
              "status": "C"
            },
            {
              "id": "1229",
              "status": "C"
            }
          ],
          "qualifier_restrictions": {}
        },
        {
          "tag": "PIA",
          "name": "Zusätzliche Produktidentifikation",
          "mandatory": false,
          "max_occurrences": 25,
          "elements": [
            {
              "id": "4347",
              "status": "M"
            },
            {
              "id": "C212",
              "status": "M"
            }
          ],
          "qualifier_restrictions": {}
        }
      ],
      "groups": [
        {
          "id": "SG28",
          "trigger_segment": "CCI",
          "mandatory": false,
          "max_occurrences": 99,
          "segments": [
            {
              "tag": "CCI",
              "name": "Characteristic/Class Id",
              "mandatory": false,
              "max_occurrences": 1,
              "elements": [
                {
                  "id": "7059",
                  "status": "C",
                  "components": 1
                },
                {
                  "id": "C502",
                  "status": "C",
                  "components": 3
                },
                {
                  "id": "C240",
                  "status": "C",
                  "components": 3
                }
              ]
            }
          ],
          "groups": []
        }
      ]
    }
  ],
  "valid_until": "2026-09-30",
  "ahb_revision": "1.3c",
  "source_document": "REQOTE MIG 1.3c, Stand 01.04.2025",
  "pid_source": "rff_z13"
}
