{
  "schema_version": 1,
  "message_type": "PARTIN",
  "release": "1.0f",
  "valid_from": "2025-10-01",
  "ordering_hint": [
    "UNH",
    "BGM",
    "DTM",
    "RFF",
    "DTM",
    "RFF",
    "NAD",
    "CTA",
    "COM",
    "NAD",
    "UNS",
    "NAD",
    "FII",
    "RFF",
    "RFF",
    "FTX",
    "CCI",
    "DTM",
    "CAV",
    "CCI",
    "NAD",
    "CTA",
    "COM",
    "UNT"
  ],
  "segments": [
    {
      "tag": "UNH",
      "name": "Message Header",
      "mandatory": true,
      "max_occurrences": 1,
      "elements": [
        {
          "id": "0062",
          "status": "M"
        },
        {
          "id": "S009",
          "status": "M"
        }
      ],
      "qualifier_restrictions": {}
    },
    {
      "tag": "BGM",
      "name": "Beginning of Message",
      "mandatory": true,
      "max_occurrences": 1,
      "elements": [
        {
          "id": "C002",
          "status": "M"
        },
        {
          "id": "C106",
          "status": "C"
        }
      ],
      "qualifier_restrictions": {
        "1001": [
          "35",
          "59"
        ]
      }
    },
    {
      "tag": "DTM",
      "name": "Date/Time/Period (Nachrichtendatum)",
      "mandatory": true,
      "max_occurrences": 1,
      "elements": [
        {
          "id": "C507",
          "status": "M"
        }
      ],
      "qualifier_restrictions": {
        "2005": [
          "137"
        ]
      }
    },
    {
      "tag": "RFF",
      "name": "Reference (Prüfidentifikator)",
      "mandatory": true,
      "max_occurrences": 1,
      "elements": [
        {
          "id": "C506",
          "status": "M"
        }
      ],
      "qualifier_restrictions": {
        "1153": [
          "Z13"
        ]
      }
    },
    {
      "tag": "RFF",
      "name": "Reference (Versionsnummer)",
      "mandatory": true,
      "max_occurrences": 1,
      "elements": [
        {
          "id": "C506",
          "status": "M"
        }
      ],
      "qualifier_restrictions": {
        "1153": [
          "AGK"
        ]
      }
    },
    {
      "tag": "DTM",
      "name": "Date/Time/Period (Gültig Ab)",
      "mandatory": false,
      "max_occurrences": 1,
      "elements": [
        {
          "id": "C507",
          "status": "M"
        }
      ],
      "qualifier_restrictions": {
        "2005": [
          "157"
        ]
      }
    },
    {
      "tag": "RFF",
      "name": "Reference (Vorgängerversion)",
      "mandatory": true,
      "max_occurrences": 1,
      "elements": [
        {
          "id": "C506",
          "status": "M"
        }
      ],
      "qualifier_restrictions": {
        "1153": [
          "ACW"
        ]
      }
    },
    {
      "tag": "NAD",
      "name": "Name and Address (Absender)",
      "mandatory": true,
      "max_occurrences": 1,
      "elements": [
        {
          "id": "3035",
          "status": "M"
        },
        {
          "id": "C082",
          "status": "M"
        }
      ],
      "qualifier_restrictions": {
        "3035": [
          "MS"
        ]
      }
    },
    {
      "tag": "CTA",
      "name": "Contact Information (Absender)",
      "mandatory": true,
      "max_occurrences": 1,
      "elements": [
        {
          "id": "3139",
          "status": "C"
        },
        {
          "id": "C056",
          "status": "C"
        }
      ],
      "qualifier_restrictions": {}
    },
    {
      "tag": "COM",
      "name": "Communication Contact (Absender)",
      "mandatory": true,
      "max_occurrences": 5,
      "elements": [
        {
          "id": "C076",
          "status": "M"
        }
      ],
      "qualifier_restrictions": {}
    },
    {
      "tag": "NAD",
      "name": "Name and Address (Empfänger)",
      "mandatory": true,
      "max_occurrences": 1,
      "elements": [
        {
          "id": "3035",
          "status": "M"
        },
        {
          "id": "C082",
          "status": "M"
        }
      ],
      "qualifier_restrictions": {
        "3035": [
          "MR"
        ]
      }
    },
    {
      "tag": "UNS",
      "name": "Section Control",
      "mandatory": true,
      "max_occurrences": 1,
      "elements": [
        {
          "id": "0081",
          "status": "M"
        }
      ],
      "qualifier_restrictions": {}
    },
    {
      "tag": "NAD",
      "name": "Name and Address (Stammdaten)",
      "mandatory": true,
      "max_occurrences": 1,
      "elements": [
        {
          "id": "3035",
          "status": "M"
        },
        {
          "id": "C080",
          "status": "C"
        },
        {
          "id": "C059",
          "status": "C"
        }
      ],
      "qualifier_restrictions": {
        "3035": [
          "SU"
        ]
      }
    },
    {
      "tag": "FII",
      "name": "Financial Institution Information",
      "mandatory": true,
      "max_occurrences": 10,
      "elements": [
        {
          "id": "3035",
          "status": "M"
        },
        {
          "id": "C078",
          "status": "C"
        },
        {
          "id": "C088",
          "status": "C"
        }
      ],
      "qualifier_restrictions": {}
    },
    {
      "tag": "RFF",
      "name": "Reference (Steuernummer/USt-ID)",
      "mandatory": true,
      "max_occurrences": 1,
      "elements": [
        {
          "id": "C506",
          "status": "M"
        }
      ],
      "qualifier_restrictions": {
        "1153": [
          "VA"
        ]
      }
    },
    {
      "tag": "RFF",
      "name": "Reference (Faxnummer)",
      "mandatory": false,
      "max_occurrences": 1,
      "elements": [
        {
          "id": "C506",
          "status": "M"
        }
      ],
      "qualifier_restrictions": {
        "1153": [
          "Z25"
        ]
      }
    },
    {
      "tag": "FTX",
      "name": "Free Text",
      "mandatory": false,
      "max_occurrences": 10,
      "elements": [
        {
          "id": "4451",
          "status": "M"
        },
        {
          "id": "C108",
          "status": "C"
        }
      ],
      "qualifier_restrictions": {}
    },
    {
      "tag": "CCI",
      "name": "Characteristic/Class Id (Erreichbarkeit)",
      "mandatory": true,
      "max_occurrences": 1,
      "elements": [
        {
          "id": "7059",
          "status": "C"
        },
        {
          "id": "C502",
          "status": "C"
        },
        {
          "id": "C240",
          "status": "C"
        }
      ],
      "qualifier_restrictions": {
        "7059": [
          "Z40"
        ]
      }
    },
    {
      "tag": "DTM",
      "name": "Date/Time/Period (Erreichbarkeit)",
      "mandatory": true,
      "max_occurrences": 6,
      "elements": [
        {
          "id": "C507",
          "status": "M"
        }
      ],
      "qualifier_restrictions": {
        "2005": [
          "Z36"
        ]
      }
    },
    {
      "tag": "CAV",
      "name": "Merkmalswert",
      "mandatory": false,
      "max_occurrences": 10,
      "elements": [
        {
          "id": "C889",
          "status": "M"
        }
      ],
      "qualifier_restrictions": {}
    },
    {
      "tag": "CCI",
      "name": "Characteristic/Class Id (Bilanzkreis)",
      "mandatory": true,
      "max_occurrences": 1,
      "elements": [
        {
          "id": "7059",
          "status": "C"
        },
        {
          "id": "C502",
          "status": "C"
        },
        {
          "id": "C240",
          "status": "C"
        }
      ],
      "qualifier_restrictions": {
        "7059": [
          "Z19"
        ]
      }
    },
    {
      "tag": "NAD",
      "name": "Name and Address (Ansprechpartner)",
      "mandatory": true,
      "max_occurrences": 11,
      "elements": [
        {
          "id": "3035",
          "status": "M"
        },
        {
          "id": "C080",
          "status": "C"
        },
        {
          "id": "C059",
          "status": "C"
        }
      ],
      "qualifier_restrictions": {
        "3035": [
          "Z10"
        ]
      }
    },
    {
      "tag": "CTA",
      "name": "Contact Information (Ansprechpartner)",
      "mandatory": true,
      "max_occurrences": 1,
      "elements": [
        {
          "id": "3139",
          "status": "C"
        },
        {
          "id": "C056",
          "status": "C"
        }
      ],
      "qualifier_restrictions": {}
    },
    {
      "tag": "COM",
      "name": "Communication Contact (Ansprechpartner)",
      "mandatory": true,
      "max_occurrences": 5,
      "elements": [
        {
          "id": "C076",
          "status": "M"
        }
      ],
      "qualifier_restrictions": {}
    },
    {
      "tag": "UNT",
      "name": "Message Trailer",
      "mandatory": true,
      "max_occurrences": 1,
      "elements": [
        {
          "id": "0074",
          "status": "M"
        },
        {
          "id": "0062",
          "status": "M"
        }
      ],
      "qualifier_restrictions": {}
    }
  ],
  "segment_groups": [],
  "valid_until": "2026-03-31",
  "ahb_revision": "1.0f",
  "source_document": "PARTIN MIG 1.0f, Stand 01.10.2025"
}
