{
  "schema_version": 1,
  "message_type": "ORDCHG",
  "release": "1.2",
  "valid_from": "2026-04-01",
  "ordering_hint": [
    "UNH",
    "BGM",
    "DTM",
    "RFF",
    "NAD",
    "UNS",
    "UNT"
  ],
  "segments": [
    {
      "tag": "UNH",
      "name": "Nachrichten-Kopfsegment",
      "mandatory": true,
      "max_occurrences": 1,
      "elements": [
        {
          "id": "0062",
          "status": "M"
        },
        {
          "id": "S009",
          "status": "M"
        }
      ],
      "qualifier_restrictions": {}
    },
    {
      "tag": "BGM",
      "name": "Beginn der Nachricht",
      "mandatory": true,
      "max_occurrences": 1,
      "elements": [
        {
          "id": "C002",
          "status": "M"
        },
        {
          "id": "C106",
          "status": "C"
        },
        {
          "id": "1225",
          "status": "C"
        }
      ],
      "qualifier_restrictions": {
        "1001": [
          "Z51",
          "Z52",
          "Z57"
        ],
        "1225": [
          "1"
        ]
      }
    },
    {
      "tag": "DTM",
      "name": "Nachrichtendatum",
      "mandatory": true,
      "max_occurrences": 1,
      "elements": [
        {
          "id": "C507",
          "status": "M"
        }
      ],
      "qualifier_restrictions": {
        "2005": [
          "137"
        ]
      }
    },
    {
      "tag": "UNS",
      "name": "Abschnitts-Kontrollsegment",
      "mandatory": true,
      "max_occurrences": 1,
      "elements": [
        {
          "id": "0081",
          "status": "M"
        }
      ],
      "qualifier_restrictions": {}
    },
    {
      "tag": "UNT",
      "name": "Nachrichten-Endesegment",
      "mandatory": true,
      "max_occurrences": 1,
      "elements": [
        {
          "id": "0074",
          "status": "M"
        },
        {
          "id": "0062",
          "status": "M"
        }
      ],
      "qualifier_restrictions": {}
    }
  ],
  "segment_groups": [
    {
      "id": "SG1",
      "trigger_segment": "RFF",
      "mandatory": true,
      "max_occurrences": 9999,
      "segments": [
        {
          "tag": "RFF",
          "name": "Referenz",
          "mandatory": true,
          "max_occurrences": 1,
          "elements": [
            {
              "id": "C506",
              "status": "M"
            }
          ],
          "qualifier_restrictions": {
            "1153": [
              "ON",
              "TN",
              "Z13"
            ]
          }
        }
      ],
      "groups": []
    },
    {
      "id": "SG3",
      "trigger_segment": "NAD",
      "mandatory": true,
      "max_occurrences": 99,
      "segments": [
        {
          "tag": "NAD",
          "name": "MP-ID Absender/Empfänger",
          "mandatory": true,
          "max_occurrences": 1,
          "elements": [
            {
              "id": "3035",
              "status": "M"
            },
            {
              "id": "C082",
              "status": "C"
            }
          ],
          "qualifier_restrictions": {
            "3035": [
              "MS",
              "MR"
            ]
          }
        }
      ],
      "groups": []
    }
  ],
  "ahb_revision": "1.2",
  "source_document": "ORDCHG MIG 1.2, Stand 01.04.2026"
}
